"conversation_id_str","created_at","favorite_count","full_text","id_str","image_url","in_reply_to_screen_name","lang","location","quote_count","reply_count","retweet_count","tweet_url","user_id_str","username"
"1845399905088700790","Sun Oct 13 09:43:17 +0000 2024","0","Jadi apakah boleh diibaratkan sbb.â‰ï¸ : Di dalam Pemerintahan Prabowo - Gibran bagaikan duri dlm daging . - PSI bagaikan musuh dlm selimut .","1845399905088700790","","","in","","0","0","0","https://x.com/EdiKeceput2/status/1845399905088700790","1530489102180958208","EdiKeceput2"
"1845399861006565842","Sun Oct 13 09:43:07 +0000 2024","2","Ganjar Konfirmasi Bakal Hadiri Pelantikan Prabowo-Gibran https://t.co/Nf4ZCjrT1t","1845399861006565842","","","in","Indonesia","0","0","1","https://x.com/TirtoID/status/1845399861006565842","4187275698","TirtoID"
"1845004619824628166","Sun Oct 13 09:43:01 +0000 2024","0","@_MbakSri_ Ga ngerti proses ya?klw Gibran bukan anak presiden apa mungkin Golkar Gerindra setuju Gibran jadi cawapres","1845399834762551619","","_MbakSri_","in","","0","0","0","https://x.com/Toni7216/status/1845399834762551619","1105363393106522112","Toni7216"
"1845286024441888916","Sun Oct 13 09:42:51 +0000 2024","0","@va_silvaH1 Terima kasih Prabowo-Gibran Program ini bawa masa depan cerah buat anak-anak di Jawa #MakanBergiziUntukBangsa","1845399795298697673","","va_silvaH1","in","","0","0","0","https://x.com/kyra_ulani/status/1845399795298697673","1702631981564215296","kyra_ulani"
"1845399679888130249","Sun Oct 13 09:42:24 +0000 2024","0","Kesehatan anak-anak harus jadi prioritas dan Prabowo-Gibran beneran take action! #MakanBergiziUntukBangsa","1845399679888130249","","","in","","0","0","0","https://x.com/yuni_andriani4/status/1845399679888130249","1711580330942234624","yuni_andriani4"
"1845399641376125121","Sun Oct 13 09:42:15 +0000 2024","0","Temui Presiden Jokowi di Solo Hari Ini Ini Momen Prabowo Subianto Disambut Gibran di Bandara https://t.co/GXBiqscul6","1845399641376125121","","","in","Indonesia","0","1","0","https://x.com/KompasTV/status/1845399641376125121","71436318","KompasTV"
"1845399640700502295","Sun Oct 13 09:42:14 +0000 2024","0","Makan bergizi gratis langkah strategis Prabowo-Gibran bangun masa depan bangsa. #MakanBergiziUntukBangsa","1845399640700502295","","","in","","0","0","0","https://x.com/vicky_arteoo/status/1845399640700502295","1691329698197057536","vicky_arteoo"
"1845399585226674421","Sun Oct 13 09:42:01 +0000 2024","0","Terima kasih Prabowo-Gibran Program ini bantu anak-anak tumbuh sehat dengan gizi seimbang #MakanBergiziUntukBangsa https://t.co/2yHEIu5JOb","1845399585226674421","https://pbs.twimg.com/media/GZwtEi9aAAIVN-q.jpg","","in","","0","0","0","https://x.com/fikri_imndn/status/1845399585226674421","1692417133916176384","fikri_imndn"
"1845399564553216054","Sun Oct 13 09:41:56 +0000 2024","0","Terima kasih Prabowo-Gibran Program ini bantu anak-anak tumbuh sehat dengan gizi seimbang #MakanBergiziUntukBangsa https://t.co/QPwADNBOYv","1845399564553216054","https://pbs.twimg.com/media/GZwtEi9aAAIVN-q.jpg","","in","","0","0","0","https://x.com/fikri_imndn/status/1845399564553216054","1692417133916176384","fikri_imndn"
"1845398226611937786","Sun Oct 13 09:41:49 +0000 2024","0","@tallyfication gibran mania sangat menggelak tawa","1845399535348306413","","tallyfication","in","","0","0","0","https://x.com/letvalsay/status/1845399535348306413","1732827791769673728","letvalsay"
"1845399531120455867","Sun Oct 13 09:41:48 +0000 2024","0","Stunting harus segera dilawan Program ini adalah solusi nyata Terima kasih Prabowo-Gibran #MakanBergiziUntukBangsa https://t.co/KWcEniviJx","1845399531120455867","https://pbs.twimg.com/media/GZwtFsdboAAwO4-.jpg","","in","","0","0","0","https://x.com/ojfficial/status/1845399531120455867","781087569035407361","ojfficial"
"1845284606276436395","Sun Oct 13 09:41:22 +0000 2024","0","@andikamalreza Utsman bin Affan RA. Suka sedekah hartanya malah bertambah Gibran suka bangkrut usahanya ditambah suka sedekah malah super duper bertambah hartanya..","1845399419446812808","","andikamalreza","in","","0","0","0","https://x.com/euriis/status/1845399419446812808","317630929","euriis"
"1845399419081879638","Sun Oct 13 09:41:22 +0000 2024","0","Sebut Tipe Yes Man Bhima Yudistira Nilai Erick Thohir Tak Layak Jadi Menteri di Kabinet Prabowo-Gibran https://t.co/1ygX5Hygnf","1845399419081879638","","","in","Jakarta, Indonesia","0","0","0","https://x.com/fajaronline/status/1845399419081879638","89877164","fajaronline"
"1845399378816795087","Sun Oct 13 09:41:12 +0000 2024","0","Dari Sumatera kami dukung Prabowo-Gibran Anak-anak layak tumbuh sehat #MakanBergiziUntukBangsa https://t.co/hkYJMvSxse","1845399378816795087","https://pbs.twimg.com/media/GZws8wCaAAI3tKS.jpg","","in","","0","0","0","https://x.com/nova_bahila24/status/1845399378816795087","1683359471756804097","nova_bahila24"
"1844941385218289909","Sun Oct 13 09:40:59 +0000 2024","0","@AdapSaya @xquitavee @prabowo @gibran_tweet Kalau dia dibasmi jadi lonte dong kan nganggur","1845399324529918075","","AdapSaya","in","Mengikuti Kamu","0","0","0","https://x.com/NaiyaSupport/status/1845399324529918075","1042244700","NaiyaSupport"
"1845322692322377756","Sun Oct 13 09:40:44 +0000 2024","0","@OjolNyambi Sekarang Jokowi lagi sibuk intimidasi pak Prabowo Subianto agar jgn ganggu anaknya si Gibran psikopat.Merasa banyak jasa pak Prabowo Subianto jadi menang pilpres karena si jokowi ikut cawe cawe.Jokowi nggak mau di buang se bagai mantan presiden.","1845399263695774005","","OjolNyambi","in","","0","0","0","https://x.com/aikacipung88/status/1845399263695774005","1834949359781462016","aikacipung88"
"1845271548523053423","Sun Oct 13 09:40:44 +0000 2024","0","@Loveyoufrom300 Anak sehat masa depan bangsa yang lebih baik bersama Prabowo-Gibran #MakanBergiziUntukBangsa","1845399262055759992","","Loveyoufrom300","in","","0","0","0","https://x.com/aney_manela/status/1845399262055759992","1700072344671473664","aney_manela"
"1845399259111456772","Sun Oct 13 09:40:43 +0000 2024","0","Terima kasih Prabowo-Gibran Program makan sehat ini bantu lawan stunting sejak dini #MakanBergiziUntukBangsa https://t.co/hULejlrNKx","1845399259111456772","https://pbs.twimg.com/media/GZws10xaAAIo2Yj.jpg","","in","","0","0","0","https://x.com/andika_doni2/status/1845399259111456772","1833801348023988224","andika_doni2"
"1845399248260694128","Sun Oct 13 09:40:41 +0000 2024","0","Keren banget Prabowo-Gibran serius mikirin masa depan anak-anak Indonesia. #MakanBergiziUntukBangsa","1845399248260694128","","","in","","0","0","0","https://x.com/aprilia_ilona/status/1845399248260694128","1690982462254657536","aprilia_ilona"
"1845399216287260750","Sun Oct 13 09:40:33 +0000 2024","0","Prabowo-Gibran peduli masa depan bangsa hadirkan program makan bergizi gratis. #MakanBergiziUntukBangsa","1845399216287260750","","","in","","0","0","0","https://x.com/danang_mandla/status/1845399216287260750","1711578731456999424","danang_mandla"
"1845374841517638100","Sun Oct 13 09:40:29 +0000 2024","0","@henriwawan0755 @aewin86 @jokowi @gibran_tweet @prabowo orang mesra malah disuruh tidak mesra terus karepmu iku piye....Prabowo Gibran tidak akur? iya gitu? ","1845399196670820529","","henriwawan0755","in","","0","0","0","https://x.com/CocoLatii/status/1845399196670820529","1842869919744155648","CocoLatii"
"1845399156363493454","Sun Oct 13 09:40:19 +0000 2024","0","Makan bergizi gratis inisiatif Prabowo-Gibran bangun generasi sehat. #MakanBergiziUntukBangsa","1845399156363493454","","","in","","0","0","0","https://x.com/cahayani_hilum/status/1845399156363493454","1691659753603379200","cahayani_hilum"
"1845399076478882036","Sun Oct 13 09:40:00 +0000 2024","16","'Gibran Demi Hukum Wajib Lengser' https://t.co/D4jiy3Lvp4","1845399076478882036","","","in","Indonesia","0","1","8","https://x.com/democrazymedia/status/1845399076478882036","1243804423001763841","democrazymedia"
"1845399060292960390","Sun Oct 13 09:39:56 +0000 2024","0","Respect buat Prabowo-Gibran program ini bakal ngefek positif jangka panjang. #MakanBergiziUntukBangsa","1845399060292960390","","","in","","0","0","0","https://x.com/lafika_halnii/status/1845399060292960390","1701825066118660096","lafika_halnii"
"1845399031989797098","Sun Oct 13 09:39:49 +0000 2024","0","Terima kasih Prabowo-Gibran langkah besar buat masa depan yang lebih cerah! #MakanBergiziUntukBangsa","1845399031989797098","","","in","","0","0","0","https://x.com/fadlan_kml/status/1845399031989797098","1689839957819658241","fadlan_kml"
"1845399000033419353","Sun Oct 13 09:39:42 +0000 2024","0","SUMPAH GAK BANGET GIBRAN DISAMA-SAMAIN KYK UTSMAN BIN AFFAN. woi gibran gak ada apa apanya njir utsman bin affan mah lelaki high value plis. sedangkan gibran????? hmmm gk banget","1845399000033419353","","","in","","0","0","0","https://x.com/vanilattecreams/status/1845399000033419353","1522771405712023552","vanilattecreams"
"1845398885726114256","Sun Oct 13 09:39:14 +0000 2024","1","Prabowo Didampingi Gibran Temui Presiden Jokowi di Rumah Solo https://t.co/Kftj9NUJA2","1845398885726114256","","","in","Jakarta Pusat, DKI Jakarta","0","0","0","https://x.com/SINDOnews/status/1845398885726114256","231355136","SINDOnews"
"1845386758411726982","Sun Oct 13 09:39:07 +0000 2024","2","@bonapasogit24 @jokowi @gibran_tweet Binatang tidak pantas memimpin manusia","1845398856521089472","","bonapasogit24","in","Bandar Melaka, Malacca","0","1","0","https://x.com/DjajaSampurna/status/1845398856521089472","2868622952","DjajaSampurna"
"1845398747036914164","Sun Oct 13 09:38:41 +0000 2024","0","Gizi yang baik = masa depan yang cerah! Bravo Prabowo-Gibran! #MakanBergiziUntukBangsa","1845398747036914164","","","in","","0","0","0","https://x.com/marha_istirah50/status/1845398747036914164","1687392625807269888","marha_istirah50"
"1845375387544715365","Sun Oct 13 09:38:37 +0000 2024","0","@bentangnegeri bener wkwkwkwkw jadi kek gak ada guna bacot bacot yg coba framing dan bikin pecah kongsi jokowi - wowo &amp; gibran ","1845398728246771837","","bentangnegeri","in","Disini","0","0","0","https://x.com/Rriskand/status/1845398728246771837","2224966111","Rriskand"
"1845398713084281190","Sun Oct 13 09:38:33 +0000 2024","0","Terima kasih Prabowo-Gibran Program makan sehat ini langkah besar cegah stunting #MakanBergiziUntukBangsa https://t.co/4iwyPG0Rj0","1845398713084281190","https://pbs.twimg.com/media/GZwsVRXaAAMce1U.jpg","","in","","0","0","0","https://x.com/rizky_dzakaa/status/1845398713084281190","1696728139437875200","rizky_dzakaa"
"1845398531668050339","Sun Oct 13 09:37:50 +0000 2024","0","Prabowo-Gibran tunjukkan kepedulian mereka pada masa depan anak-anak. #MakanBergiziUntukBangsa","1845398531668050339","","","in","","0","0","0","https://x.com/Yud_lesmon9/status/1845398531668050339","1698957731473100800","Yud_lesmon9"
"1845306235345899617","Sun Oct 13 09:37:47 +0000 2024","0","@TxtdariTxThehe @ARSIPAJA Liat podcastnya sama panji milih Gibran biar ga ada korupsi kata si botak wkwk","1845398520372789652","","TxtdariTxThehe","in","","0","0","0","https://x.com/Sky_Buz5/status/1845398520372789652","1769464572443037696","Sky_Buz5"
"1845398501276123156","Sun Oct 13 09:37:43 +0000 2024","0","Program makan bergizi Prabowo-Gibran masa depan anak Indonesia terjamin. #MakanBergiziUntukBangsa","1845398501276123156","","","in","","0","0","0","https://x.com/sarah_lutfiah68/status/1845398501276123156","1688846318150795265","sarah_lutfiah68"
"1845398499652927684","Sun Oct 13 09:37:42 +0000 2024","0","Apa ngak bahaya utk @Prabowo utk kesehatan dan lainnya pertemuan disolo dgn jokowi dan gibran coba @BocorAlusPol utk cari tau infonya #JokowiHarusDiadili #JokowiHarusDiadili https://t.co/TUwq1qq29M","1845398499652927684","https://pbs.twimg.com/media/GZwsJ5WaAAEr3_s.jpg","","in","","0","0","0","https://x.com/DhannyAgus29159/status/1845398499652927684","1762776188584595456","DhannyAgus29159"
"1845327981478302107","Sun Oct 13 09:37:35 +0000 2024","0","@Ndons_Back @BocorAlusPol @are_inismyname @florieliciouss @BANGSAygSUJUD @Kimberley_PS08 @99propaganda @Chavesz08 @DarekaRendy @IrawanRommi Menunggu tangkapan layar Pak Prabowo dan Mas Gibran di Solo trus dipelintir-pelintir https://t.co/uT2hkHw1iw","1845398467365175632","https://pbs.twimg.com/ext_tw_video_thumb/1845397611882463232/pu/img/XJdtzoT0UfWU3lhn.jpg","Ndons_Back","in","Kota Surabaya, Jawa Timur","0","0","0","https://x.com/majeliskopi08/status/1845398467365175632","2290227306","majeliskopi08"
"1845398388642390050","Sun Oct 13 09:37:16 +0000 2024","1","Sejarah pendidikan Gibran mau pun Jokowi tidak jelas.Anehnya penegak Hukum diam seolah membiarkan Kejahatan .","1845398388642390050","","","in","Kota Bukittinggi, Sumatera Bar","0","0","1","https://x.com/MocangTian/status/1845398388642390050","1509700424018063369","MocangTian"
"1845271512313626964","Sun Oct 13 09:36:33 +0000 2024","0","@Chellianeezz21 Makan siang gratis Prabowo-Gibran dukungan nyata untuk generasi yang lebih kuat. #MakanBergiziUntukBangsa","1845398209964933149","","Chellianeezz21","in","","0","0","0","https://x.com/mhmmd_albil37/status/1845398209964933149","1684399925650661376","mhmmd_albil37"
"1845398166721470686","Sun Oct 13 09:36:23 +0000 2024","0","Terima kasih kepada Prabowo-Gibran yang telah menunjukkan komitmen kuat untuk mendukung kesehatan rakyat #MakanBergiziUntukBangsa","1845398166721470686","","","in","","0","0","0","https://x.com/adiwijaya03_/status/1845398166721470686","1813802739065106432","adiwijaya03_"
"1845398054750519645","Sun Oct 13 09:35:56 +0000 2024","0","Terima kasih Prabowo-Gibran program ini memberikan harapan untuk anak-anak kita! #MakanBergiziUntukBangsa","1845398054750519645","","","in","","0","0","0","https://x.com/jessica_stmpul/status/1845398054750519645","1702544787017191424","jessica_stmpul"
"1845397985481589013","Sun Oct 13 09:35:40 +0000 2024","0","Prabowo-Gibran membuktikan komitmen mereka untuk masa depan anak-anak Indonesia. #MakanBergiziUntukBangsa","1845397985481589013","","","in","","0","0","0","https://x.com/clara_mira3/status/1845397985481589013","1686940658584719360","clara_mira3"
"1845272274016010333","Sun Oct 13 09:35:08 +0000 2024","0","@Kadalkawin2x Prabowo-Gibran paham pentingnya gizi buat anak-anak Masa depan bangsa lebih cerah #MakanBergiziUntukBangsa","1845397854254399856","","Kadalkawin2x","in","","0","0","0","https://x.com/zakaisya_zeilin/status/1845397854254399856","1702642467726921728","zakaisya_zeilin"
"1845397852333174960","Sun Oct 13 09:35:08 +0000 2024","0","Prabowo-Gibran tau banget gimana caranya bikin perubahan yang beneran terasa. #MakanBergiziUntukBangsa https://t.co/6jjCCx26CQ","1845397852333174960","https://pbs.twimg.com/media/GZwrj2ia0AAF-3_.jpg","","in","","0","0","0","https://x.com/ikhsan_winarmo1/status/1845397852333174960","1701138439943671808","ikhsan_winarmo1"
"1845397848327966892","Sun Oct 13 09:35:07 +0000 2024","0","Langkah bijaksana Prabowo-Gibran ini adalah bentuk perhatian nyata terhadap masa depan generasi penerus bangsa. #MakanBergiziUntukBangsa","1845397848327966892","","","in","","0","0","0","https://x.com/chlsee_isndr/status/1845397848327966892","1481488619051565059","chlsee_isndr"
"1845397795756441704","Sun Oct 13 09:34:54 +0000 2024","0","Langkah tepat Prabowo-Gibran makan bergizi90. Langkah tepat Prabowo-Gibran makan bergizi gratis untuk masa depan bangsa. #MakanBergiziUntukBangsa","1845397795756441704","","","in","","0","0","0","https://x.com/johan_wijayaa/status/1845397795756441704","1697092113060724736","johan_wijayaa"
"1845104040637759583","Sun Oct 13 09:34:47 +0000 2024","0","@OposisiCerdas Oalah..masih ada saja yg kek ginian di era internet berapa duit bapakmu bayar giniian @gibran_tweet ?","1845397764865249760","","OposisiCerdas","in","indonesia","0","0","0","https://x.com/ballambinlove/status/1845397764865249760","114452217","ballambinlove"
"1845397746729222416","Sun Oct 13 09:34:43 +0000 2024","0","Prabowo-Gibran ngerti bahwa kesehatan anak-anak adalah investasi terbaik buat bangsa. #MakanBergiziUntukBangsa https://t.co/69CSrtKcMz","1845397746729222416","https://pbs.twimg.com/media/GZwrdw5bsAAWJF-.jpg","","in","","0","0","0","https://x.com/hazema_hdn4/status/1845397746729222416","1701037671811088384","hazema_hdn4"
"1845397736306487297","Sun Oct 13 09:34:40 +0000 2024","0","Kira kira bahas apa yaa Momen Gibran Sambut Prabowo usai Mendarat di Boyolali https://t.co/rCrxa5im9z Install aplikasi kumparan baca lebih nyaman tanpa iklan https://t.co/YT9Xe5zjgq","1845397736306487297","","","in","Saray, TekirdaÄŸ","0","0","0","https://x.com/Riza_Bafadhal01/status/1845397736306487297","1096721281985142789","Riza_Bafadhal01"
"1845397594673119343","Sun Oct 13 09:34:07 +0000 2024","6","Pertemuan 90 Menit Jokowi Prabowo dan Gibran di Solo #newsupdate #update #news #text https://t.co/zQe5X9fwwL","1845397594673119343","","","in","","0","4","2","https://x.com/kumparan/status/1845397594673119343","759692754985242625","kumparan"
"1845129664483950807","Sun Oct 13 09:33:56 +0000 2024","0","@Paradox_Buzz @DokterTifa Klo bener puan yg naik berarti kuat bener ini jalur pemecah belah yang digunakan buat hancurin pertemanan Prabowo &amp; Gibran. Kita lihat ada berita apa lagi yang digunakan pihak sebelah untuk memecah belah","1845397551287238810","","Paradox_Buzz","in","","0","0","0","https://x.com/AldityaAji/status/1845397551287238810","1689628330361065472","AldityaAji"
"1845397402079068320","Sun Oct 13 09:33:21 +0000 2024","1","Kek nya Gibran mengakui akun fufufafa dan meminta maaf dihadapan Prabowo disaksikan Jokowi. Gitu gak bang iyut @kafiradikalis .?","1845397402079068320","","","in","Jakarta Capital Region, Indone","0","0","0","https://x.com/rendranila/status/1845397402079068320","260392113","rendranila"
"1845397270407282726","Sun Oct 13 09:32:49 +0000 2024","0","Prabowo-Gibran punya visi besar untuk kesehatan dan kesejahteraan generasi penerus. #MakanBergiziUntukBangsa","1845397270407282726","","","in","","0","0","0","https://x.com/michelle_pj22/status/1845397270407282726","1698958761929699328","michelle_pj22"
"1845397262010286155","Sun Oct 13 09:32:47 +0000 2024","0","Terima kasih Prabowo-Gibran Program ini jamin anak-anak tumbuh sehat dengan gizi optimal #MakanBergiziUntukBangsa https://t.co/2NE7zolFBI","1845397262010286155","https://pbs.twimg.com/media/GZwq_LBaAAEj7tc.jpg","","in","","0","0","0","https://x.com/cahya_purnama01/status/1845397262010286155","1694910861650067456","cahya_purnama01"
"1845306201032229372","Sun Oct 13 09:31:57 +0000 2024","0","@tang__kira ini apa judul acaranya? Tahu triple star karena nonton chef culinary wars tapi kayanya ga ada segmen beginian","1845397050499924251","","tang__kira","in","","0","1","0","https://x.com/Awqi_Gibran/status/1845397050499924251","71742129","Awqi_Gibran"
"1845089230239957129","Sun Oct 13 09:30:56 +0000 2024","0","@Heraloebss Budi Gunadi Sadikin?? JANGAN yah Pak @prabowo @gibran_tweet ","1845396795997945945","","Heraloebss","in","","0","0","0","https://x.com/ELSULFAT04/status/1845396795997945945","1744374113974534144","ELSULFAT04"
"1843950611722838033","Sun Oct 13 09:30:54 +0000 2024","0","@yudhomareskha @immanuel_padang @YAlysbs43141 @Andr1y_Shevch @HelloItsMeNegan @humaira979 @jojo_botak @slankdotcom @jokowi Hadeh jelas-jelas ketua KPU peternak ani-ani itu sampe dipecat masih aja nyembah gibran.","1845396788045545835","","yudhomareskha","in","Delft, Nederland","0","1","0","https://x.com/rhezonator/status/1845396788045545835","1794628790158864384","rhezonator"
"1845396769976484217","Sun Oct 13 09:30:50 +0000 2024","0","Generasi sehat tanpa stunting adalah harapan bangsa Dukung penuh Prabowo-Gibran #MakanBergiziUntukBangsa https://t.co/wtZa4vdqKU","1845396769976484217","https://pbs.twimg.com/media/GZwqk7KbUAANfma.jpg","","in","","0","0","0","https://x.com/wulan_nurdiynti/status/1845396769976484217","1703701802863222784","wulan_nurdiynti"
"1845396760622998014","Sun Oct 13 09:30:48 +0000 2024","0","Terima kasih Prabowo-Gibran Program ini sangat berarti buat cegah stunting sejak dini #MakanBergiziUntukBangsa https://t.co/0rC6SAFyBU","1845396760622998014","https://pbs.twimg.com/media/GZwqkasaAAAFy6K.jpg","","in","","0","0","0","https://x.com/zara_tusita/status/1845396760622998014","1689534612102631424","zara_tusita"
"1845396731904852262","Sun Oct 13 09:30:41 +0000 2024","0","Program makan bergizi Prabowo-Gibran selamatkan anak Indonesia dari kekurangan gizi. #MakanBergiziUntukBangsa","1845396731904852262","","","in","","0","0","0","https://x.com/assyra_hime/status/1845396731904852262","1702567042745081856","assyra_hime"
"1845396725600526612","Sun Oct 13 09:30:39 +0000 2024","0","Program makan bergizi Prabowo-Gibran solusi jitu untuk masa depan Indonesia. #MakanBergiziUntukBangsa","1845396725600526612","","","in","","0","0","0","https://x.com/rita_sugiarti4/status/1845396725600526612","1701149690795048960","rita_sugiarti4"
"1845023571225215118","Sun Oct 13 09:29:55 +0000 2024","0","@bacottetangga__ endonesia cemas @gibran_tweet","1845396539054883075","","bacottetangga__","in","","0","0","0","https://x.com/situmejik/status/1845396539054883075","1315474206071517184","situmejik"
"1845322382187299260","Sun Oct 13 09:29:50 +0000 2024","0","@0tk0il jelek banget namanya Gibran Mania","1845396519303905437","","0tk0il","in","","0","0","0","https://x.com/harihangha/status/1845396519303905437","1489676960","harihangha"
"1845396515197784286","Sun Oct 13 09:29:49 +0000 2024","0","Makan bergizi gratis dari Prabowo-Gibran selamatkan anak bangsa dari kekurangan gizi. #MakanBergiziUntukBangsa","1845396515197784286","","","in","","0","0","0","https://x.com/tasdik_hakim/status/1845396515197784286","1701451230340694017","tasdik_hakim"
"1845396505483788292","Sun Oct 13 09:29:47 +0000 2024","0","Langkah ini menunjukkan bahwa kepemimpinan Prabowo-Gibran tidak hanya berfokus pada pembangunan infrastruktur tetapi juga sumber daya manusia. #MakanBergiziUntukBangsa https://t.co/TfKeLCqY2K","1845396505483788292","https://pbs.twimg.com/media/GZwqVlhaAAQ2r-v.jpg","","in","","0","0","0","https://x.com/amima_runah/status/1845396505483788292","1683756970568990720","amima_runah"
"1845396479336189983","Sun Oct 13 09:29:41 +0000 2024","0","Program ini menunjukkan bahwa Prabowo-Gibran benar-benar peduli pada masa depan generasi muda. #MakanBergiziUntukBangsa https://t.co/vbmZCYvTrn","1845396479336189983","https://pbs.twimg.com/media/GZwqTvHaAAAH-7e.jpg","","in","ka abay fully owns my heart â™¡â €","0","0","0","https://x.com/skqyy/status/1845396479336189983","1347549139664470016","skqyy"
"1845282338558836982","Sun Oct 13 09:29:27 +0000 2024","0","@IndonesiaJadi Terima kasih Prabowo-Gibran Program makan sehat ini bantu anak-anak Jawa tumbuh sehat #MakanBergiziUntukBangsa","1845396420347756559","","IndonesiaJadi","in","","0","0","0","https://x.com/baktiono_latupn/status/1845396420347756559","1698954224216969216","baktiono_latupn"
"1845396396893216909","Sun Oct 13 09:29:21 +0000 2024","0","Wah terima kasih Prabowo-Gibran anak-anak kita sekarang bisa makan bergizi! #MakanBergiziUntukBangsa","1845396396893216909","","","in","","0","0","0","https://x.com/ilham_anggraa/status/1845396396893216909","1703974781547356160","ilham_anggraa"
"1845315592091468136","Sun Oct 13 09:28:51 +0000 2024","0","@ferrykoto Percaya sama Gibran? Masa dia terus terang bilang cawecawe.. secara santun ya dia pasti bilang memberi masukan . Tempo mah udah bener. Gitu aja kok repot.","1845396269310857715","","ferrykoto","in","Bandung, Jawa Barat","0","0","0","https://x.com/bangjiper/status/1845396269310857715","1645849567","bangjiper"
"1845268930614678005","Sun Oct 13 09:28:48 +0000 2024","0","@tenwayvx Maaf gurunya sekilas mirip gibran","1845396257323483353","","tenwayvx","in","","0","0","0","https://x.com/skysooo98/status/1845396257323483353","1666450998540353536","skysooo98"
"1845396195071656161","Sun Oct 13 09:28:33 +0000 2024","1","Momen Prabowo Subianto Dijemput Gibran Rakabuming Bertemu Presiden Jokowi di Solo https://t.co/AnlKbSdYCR","1845396195071656161","","","in","Indonesia","0","0","0","https://x.com/KompasTV/status/1845396195071656161","71436318","KompasTV"
"1845396115493113868","Sun Oct 13 09:28:14 +0000 2024","0","Bek syedara tinggai support program nyoe! #MakanBergiziUntukBangsa","1845396115493113868","","","in","","0","0","0","https://x.com/gibran_abidin24/status/1845396115493113868","1687325222708629504","gibran_abidin24"
"1845396054986064136","Sun Oct 13 09:27:59 +0000 2024","0","Langkah Prabowo-Gibran dengan makan bergizi selamatkan masa depan bangsa. #MakanBergiziUntukBangsa","1845396054986064136","","","in","","0","0","0","https://x.com/delisa_aramita/status/1845396054986064136","1697452253664481280","delisa_aramita"
"1845395953387438089","Sun Oct 13 09:27:35 +0000 2024","0","Langkah tepat Prabowo-Gibran makan bergizi gratis untuk generasi unggul. #MakanBergiziUntukBangsa","1845395953387438089","","","in","","0","0","0","https://x.com/syabira_alula/status/1845395953387438089","1700362503736455168","syabira_alula"
"1845395943409189185","Sun Oct 13 09:27:33 +0000 2024","0","Ini sih bakal ngubah hidup banyak anak di Indonesia. Good job Prabowo-Gibran! #MakanBergiziUntukBangsa","1845395943409189185","","","in","","0","0","0","https://x.com/viona_nirmala/status/1845395943409189185","1702622538390704128","viona_nirmala"
"1845119525534171506","Sun Oct 13 09:27:23 +0000 2024","0","@cobeh2022 udah gak laku....hari ini prabowo ke solo dijemput gibran dan satu mobil ke rumah jokowi.... pinter dikit dong","1845395901558423635","","cobeh2022","in","","0","0","0","https://x.com/NoahRyder16/status/1845395901558423635","1459188159816749056","NoahRyder16"
"1845395836563489060","Sun Oct 13 09:27:07 +0000 2024","0","WHAT IS GIBRAN MANIA ASUUUU JELEK BANGETT NAJISSSS","1845395836563489060","","","in","SHE/HERâ€“20","0","0","0","https://x.com/haechieo/status/1845395836563489060","1281948659559444480","haechieo"
